il_adi,ilce_adi,mahalle_adi,tesis_adi,x,y
BURSA,YILDIRIM,YUNUSEMRE,Leylak  Parkı,29.10468845359205,40.19949438579287
BURSA,YILDIRIM,YUNUSEMRE,ORKİDE PARKI (BEYPINAR SK.),29.103583156914674,40.21008881362982
BURSA,YILDIRIM,YUNUSEMRE,Söğüt Parkı,29.104090271513087,40.20273510518151
BURSA,YILDIRIM,YUNUSEMRE,Spor Kompleksi Üstü Yeşil Alan,29.11117310223675,40.19946857783168
BURSA,YILDIRIM,YUNUSEMRE,Şahin Başol Spor Kompleksi,29.108085290598954,40.206569276874475
BURSA,YILDIRIM,YUNUSEMRE,ŞEHİT HARUN ARVAS ORTAOKULU,29.103266100060566,40.20797758166795
BURSA,YILDIRIM,YUNUSEMRE,Şehit Sinan UÇAN Parkı Ve Karşısı Boş Arazi,29.102354130704352,40.20688808876052
BURSA,YILDIRIM,YUNUSEMRE,YUNUS EMRE MEYDANI,29.102449331494125,40.20889033931668
BURSA,YILDIRIM,YUNUSEMRE,YUNUS EMRE SPOR KOMPLEKSİ,29.111100976485165,40.201013261302094
