il_adi,ilce_adi,mahalle_adi,tesis_adi,x,y
İSTANBUL,Pendik,ÇAMLIK,Kosovalı Şehit Adem Yaşari Parkı,29.28543,40.92408
İSTANBUL,Pendik,ÇAMLIK,Engelli  Rehabilitasyon Merkezi  Parkı,29.28433,40.92623
İSTANBUL,Pendik,ÇAMLIK,Kutlu Sokak Park ve Antrenman Sahası,29.26988,40.92473
İSTANBUL,Pendik,ÇAMLIK,Aydın Oran Spor Tesisleri Arkası,29.28379,40.93151
İSTANBUL,Pendik,ÇAMLIK,Aydos Spor Kulübü,29.27011,40.92154
İSTANBUL,Pendik,ÇAMLIK,Necip Fazıl Kısakürek Ortaokulu Bahçesi,29.28842,40.92109
İSTANBUL,Pendik,ÇAMLIK,Bb Pendik Çamlık Spor Tesisleri,29.28072,40.92861
