il_adi,ilce_adi,mahalle_adi,tesis_adi,x,y
KAYSERİ,HACILAR,-,Hac lar Akyaz  Toplanma Alan ,35.449751276550984,38.65823433616047
KAYSERİ,HACILAR,-,Hac lar Yukar  Mahalle Toplanma Alan ,35.44577822170619,38.64394100796935
KAYSERİ,HACILAR,-,Hac lar Erciyes Mahallesi 2. Toplanma Alan ,35.4726868949558,38.65917457969141
KAYSERİ,HACILAR,-,Hac lar Erciyes Mahallesi Toplanma Alan ,35.46959730908995,38.65972711468652
KAYSERİ,HACILAR,-,Hac lar Toplanma Alan ,35.451508470753026,38.64544672947861
KAYSERİ,HACILAR,-,Hac lar Be endik Mahallesi Toplanma Alan ,35.41198287056559,38.66361802000927
