il_adi,ilce_adi,mahalle_adi,tesis_adi,x,y
BURSA,OSMANGAZİ,YENİKENT,Yenikent Mah.Dinlenme Parkı,28.980772128843164,40.26605264847638
BURSA,OSMANGAZİ,YENİKENT,Yenikent Mah. Hamitler TOKİ Park,28.983446123355858,40.267386583439304
BURSA,OSMANGAZİ,YENİKENT,Yenikent Mah. TOKİ Pazar Yeri,28.982916449263655,40.271403001107494
BURSA,OSMANGAZİ,YENİKENT,Yenikent Mah. TOKİ Top Sahası,28.984688530998135,40.27477265762741
BURSA,OSMANGAZİ,YENİKENT,Yenikent Mah. Yenibahar Çocuk Parkı,28.9848735884057,40.268352364746676
BURSA,OSMANGAZİ,YENİKENT,Yenikent Mah.Yenikent Cami Park Yanı,28.980250172839714,40.268208384005995
BURSA,OSMANGAZİ,YENİKENT,Yenikent Mah. Yeni Yıl Parkı,28.980756786541175,40.267263995702486
