il_adi,ilce_adi,mahalle_adi,tesis_adi,x,y
BURSA,OSMANGAZİ,ÇELTİKKÖY,Celtik Mah. Yüzbaşı Doğan Sevinç Parkı,29.02906058410829,40.24556449234209
BURSA,OSMANGAZİ,ÇELTİKKÖY,Çeltik Mah. Ayazma Çocuk Parkı,29.030571694730448,40.244447122590636
BURSA,OSMANGAZİ,ÇELTİKKÖY,Çeltik Mah. Çeltik Halı Saha,29.027265444331174,40.248576818790404
BURSA,OSMANGAZİ,ÇELTİKKÖY,Çeltik Mah. Şehitler Sok. Çınardibi Yeşil Alan,29.027829186473614,40.247484514360956
BURSA,OSMANGAZİ,ÇELTİKKÖY,Çeltik Mah. Yunuseli Çıkışı Üçgen Alan,29.02318244333333,40.24004738
